{
  "envelope_version": "1.2",
  "work_item_id": "wi_c_subject",
  "run_id": "run_20260904T100000Z_000001",
  "envelope_id": "env_context",
  "dispatch_id": "d_001",
  "agent": "context-discovery",
  "agent_version": "1.0",
  "model": "claude-opus-5",
  "skills_used": [],
  "stage_in": "CONTEXT_DISCOVERY",
  "started_at": "2026-09-04T10:41:00Z",
  "completed_at": "2026-09-04T10:44:00Z",
  "cost": {
    "input_tokens": 1000,
    "output_tokens": 100
  },
  "status": "COMPLETE",
  "summary": "the admitted scope is one file, README.md, and it was read. The Context Package the probes built covers it, intent and code agree about what it says, and nothing about this work item is left unaccounted for.",
  "findings": [],
  "evidence": [
    {
      "id": "E-01",
      "kind": "file",
      "locator": {
        "adapter": "repo",
        "op": "read_file",
        "args": {
          "path": "README.md"
        }
      },
      "ref": "README.md",
      "excerpt": "Intentra",
      "observed_at": "2026-09-04T10:41:00Z",
      "reproducible": true
    }
  ],
  "assumptions": [],
  "unknowns": [],
  "artifacts_changed": [],
  "recommendations": [],
  "blockers": [],
  "coverage": {
    "scope_examined": [
      "README.md"
    ],
    "scope_not_examined": [],
    "confidence": "FACT"
  },
  "outputs": {
    "context_package": "context/v1.json",
    "current_reality": "context/v1.json#current_reality",
    "gaps": "context/v1.json#gaps"
  },
  "dod_verdicts": [
    {
      "criterion": 1,
      "verdict": "MET",
      "reason": null,
      "evidence": [
        "E-01"
      ],
      "capability": "cap.subject"
    }
  ],
  "proposals": {},
  "next_action": null
}
